{
  "schemaVersion": "elegy-plugin-package/v1",
  "identity": {
    "packageId": "elegy.demo-plugin",
    "name": "demo-plugin",
    "version": "0.1.0",
    "displayName": "Elegy Demo Plugin"
  },
  "metadata": {
    "description": "Portable package fixture for a governed skill definition and optional MCP projection metadata.",
    "tags": ["plugin", "demo"],
    "license": "MIT",
    "documentationUri": "https://elegy/contracts/docs/demo-plugin"
  },
  "components": {
    "skillDefinitions": [
      {
        "id": "demo-skill",
        "definitionRef": "skills/demo/skill.json",
        "definition": {
          "skillFormat": "elegy-skill-definition",
          "skillVersion": 2,
          "identity": {
            "namespace": "elegy",
            "name": "demo-plugin",
            "version": "0.1.0",
            "displayName": "Demo Plugin Skill"
          },
          "metadata": {
            "displayName": "Demo Plugin Skill",
            "description": "Demonstrates portable plugin package capability metadata.",
            "category": "demo",
            "tags": ["plugin", "demo"]
          },
          "capabilities": [
            {
              "id": "demo-search",
              "name": "Demo Search",
              "description": "Search demo package data.",
              "implementation": {
                "executionType": "mcp",
                "executableName": "elegy-demo-mcp",
                "arguments": ["search", "--query", "${query}", "--json"]
              },
              "input": {
                "parameters": [
                  {
                    "name": "query",
                    "type": "string",
                    "description": "Search query.",
                    "required": true
                  }
                ],
                "schemaRef": "https://elegy/contracts/schemas/demo-search-input.schema.json"
              },
              "output": {
                "resultType": "DemoSearchResult",
                "schemaRef": "https://elegy/contracts/schemas/demo-search-result.schema.json"
              },
              "execution": {
                "mode": "requestResponse",
                "isDeterministic": true,
                "hasSideEffects": false,
                "timeoutSeconds": 30
              }
            }
          ],
          "governance": {
            "riskLevel": "low",
            "approvalRequirement": "none",
            "policyRefs": []
          },
          "origin": {
            "materializationKind": "declared",
            "sourceKind": "manual",
            "sourceRef": "contracts/fixtures/elegy-plugin-package-v1.minimal.json"
          },
          "lifecycleState": "active"
        }
      }
    ],
    "instructionSkills": [
      {
        "id": "demo-instructions",
        "path": "skills/demo/SKILL.md",
        "description": "Optional instruction surface derived from the governed skill definition."
      }
    ],
    "mcpProjections": [
      {
        "id": "demo-mcp",
        "descriptorRef": "mcp/demo-server.json",
        "serverName": "elegy-demo-mcp",
        "capabilityRefs": [
          {
            "skill": "elegy.demo-plugin",
            "capability": "demo-search"
          }
        ]
      }
    ],
    "capabilityProjections": [
      {
        "id": "demo-search-mcp",
        "skill": "elegy.demo-plugin",
        "capability": "demo-search",
        "lane": "mcp",
        "supportsDryRun": true,
        "inputSchema": {
          "type": "object",
          "properties": {
            "query": {
              "type": "string"
            }
          },
          "required": ["query"],
          "additionalProperties": false
        },
        "outputSchema": {
          "type": "object",
          "properties": {
            "items": {
              "type": "array",
              "items": {
                "type": "string"
              }
            }
          },
          "required": ["items"],
          "additionalProperties": false
        },
        "sideEffectClass": "none",
        "projection": {
          "projections": ["function_calling", "mcp"],
          "functionName": "demo_search",
          "mcpToolName": "demo.search"
        }
      }
    ],
    "docs": [
      {
        "id": "readme",
        "path": "README.md"
      }
    ],
    "assets": [
      {
        "id": "icon",
        "path": "assets/icon.svg"
      }
    ]
  },
  "hostPolicyHints": {
    "sideEffectClass": "none",
    "requiresApproval": false,
    "policyTags": ["dry-run-ok"]
  }
}
